{
  "blacklisted": false,
  "malicious_activity": false,
  "malicious_activity_recent": false,
  "credentials_leaked": true,
  "credentials_leaked_recent": false,
  "data_breach": true,
  "first_seen": "07/01/2008",
  "last_seen": "05/24/2019",
  "domain_exists": true,
  "domain_reputation": "high",
  "new_domain": false,
  "days_since_domain_creation": 10341,
  "suspicious_tld": false,
  "spam": false,
  "free_provider": false,
  "disposable": false,
  "deliverable": true,
  "accept_all": true,
  "valid_mx": true,
  "spoofable": false,
  "spf_strict": true,
  "dmarc_enforced": true,
  "profiles": [
    "myspace",
    "spotify",
    "twitter",
    "pinterest",
    "flickr",
    "linkedin",
    "vimeo",
    "angellist"
  ]
}